[
  {
    "id": "truerc-singularity-5g8-sma",
    "name": "TrueRC Singularity 5.8 SMA",
    "vendor": "TrueRC",
    "version": 1,
    "verified": false,
    "type": "other",
    "gainDbi": 1.9,
    "polarization": "rhcp",
    "bandHz": [
      5600000000.0,
      6000000000.0
    ],
    "source": {
      "kind": "datasheet",
      "reference": "TrueRC product page, Singularity 5.8 SMA: Gain 1.9dBic, Bandwidth 5.6GHz-6.0GHz, Polarization RHCP or LHCP",
      "url": "https://truerc.com/71964-singularity-58-sma",
      "retrieved": "2026-10-20"
    },
    "notes": "Vendor states circular-polarization gain in dBic; stored as gainDbi. Omnidirectional CP antenna. Also sold as LHCP with the same figures. Unverified until an admin checks the source."
  },
  {
    "id": "truerc-singularity-5g8-ufl",
    "name": "TrueRC Singularity 5.8 U.FL",
    "vendor": "TrueRC",
    "version": 1,
    "verified": false,
    "type": "other",
    "gainDbi": 1.9,
    "polarization": "rhcp",
    "bandHz": [
      5600000000.0,
      6000000000.0
    ],
    "source": {
      "kind": "datasheet",
      "reference": "TrueRC product page, Singularity 5.8 U.FL: Gain 1.9 dBic, Bandwidth 5.6GHz-6.0GHz, Polarization RHCP or LHCP",
      "url": "https://truerc.com/71966-singularity-58-ufl",
      "retrieved": "2026-10-20"
    },
    "notes": "Vendor states circular-polarization gain in dBic; stored as gainDbi. Omnidirectional CP antenna for VTX/air units. Also sold as LHCP with the same figures. Unverified until an admin checks the source."
  },
  {
    "id": "truerc-matchstick-5g8",
    "name": "TrueRC Matchstick 5.8 SMA",
    "vendor": "TrueRC",
    "version": 1,
    "verified": false,
    "type": "other",
    "gainDbi": 1.9,
    "polarization": "rhcp",
    "bandHz": [
      5600000000.0,
      6000000000.0
    ],
    "source": {
      "kind": "datasheet",
      "reference": "TrueRC product page, Matchstick 5.8 SMA: Gain 1.9dBic, Bandwidth 5.6-6.0GHz, available in RHCP and LHCP",
      "url": "https://truerc.com/23679-matchstick-5-8",
      "retrieved": "2026-10-20"
    },
    "notes": "Vendor states circular-polarization gain in dBic; stored as gainDbi. Omnidirectional CP antenna. Also sold as LHCP with the same figures. Unverified until an admin checks the source."
  },
  {
    "id": "truerc-x-air-5g8-mk2",
    "name": "TrueRC X-AIR 5.8 MK II",
    "vendor": "TrueRC",
    "version": 1,
    "verified": false,
    "type": "other",
    "gainDbi": 9.5,
    "polarization": "rhcp",
    "bandHz": [
      5100000000.0,
      6700000000.0
    ],
    "beamwidthDeg": {
      "horizontal": 68,
      "vertical": 68
    },
    "source": {
      "kind": "datasheet",
      "reference": "TrueRC product page, X-AIR 5.8 MK II RP-SMA: Gain 9.5-10.5 dBic, Bandwidth 5.1GHz-6.7GHz, Beam-width 120deg, Beam-width @-3dB (H and V) 68deg",
      "url": "https://truerc.com/63425-x-air-58-mk-ii-rp-sma",
      "retrieved": "2026-10-20"
    },
    "notes": "Vendor states circular-polarization gain in dBic; stored as gainDbi. Directional crosshair antenna for the ground station. Gain is the lower end of the vendor's 9.5-10.5 dBic range. Vendor's 120 deg 'beam-width' is coverage equivalent to an omni; the 68 deg -3 dB width the vendor gives for both planes (H and V) is stored. Also sold as LHCP. Unverified until an admin checks the source."
  },
  {
    "id": "truerc-x-air-2g4-mk2",
    "name": "TrueRC X-AIR 2.4 MK II",
    "vendor": "TrueRC",
    "version": 1,
    "verified": false,
    "type": "other",
    "gainDbi": 9.5,
    "polarization": "rhcp",
    "bandHz": [
      2300000000.0,
      2600000000.0
    ],
    "beamwidthDeg": {
      "horizontal": 68,
      "vertical": 68
    },
    "source": {
      "kind": "datasheet",
      "reference": "TrueRC product page, X-AIR 2.4 MK II: Gain 9.5-10 dBic, Bandwidth 2.3GHz-2.6GHz, Beam-width 120deg, Beam-width @-3dB 68deg",
      "url": "https://truerc.com/51361-x-air-2-4-mk-ii",
      "retrieved": "2026-10-20"
    },
    "notes": "Vendor states circular-polarization gain in dBic; stored as gainDbi. Directional crosshair antenna for the ground station. Gain is the lower end of the vendor's 9.5-10 dBic range. Vendor's 120 deg 'beam-width' is coverage equivalent to an omni; the -3 dB width is stored. The vendor does not name a plane for the 68 deg -3 dB width; it is stored for both. Also sold as LHCP. Unverified until an admin checks the source."
  },
  {
    "id": "truerc-x-air-900",
    "name": "TrueRC X-AIR 900",
    "vendor": "TrueRC",
    "version": 1,
    "verified": false,
    "type": "other",
    "gainDbi": 10.0,
    "polarization": "rhcp",
    "bandHz": [
      902000000.0,
      928000000.0
    ],
    "beamwidthDeg": {
      "horizontal": 68,
      "vertical": 68
    },
    "source": {
      "kind": "datasheet",
      "reference": "TrueRC product page, X-AIR 900: Gain 10dBic, Frequency 900MHz ISM band, Beam-width 120deg, Beam-width @-3dB 68deg",
      "url": "https://truerc.com/39463-x-air-900",
      "retrieved": "2026-10-20"
    },
    "notes": "Vendor states circular-polarization gain in dBic; stored as gainDbi. Directional crosshair antenna for the ground station. The vendor names only the 900 MHz ISM band; bandHz is set to 902-928 MHz, the US ISM band edges. Check before using it at 868 MHz. Vendor's 120 deg 'beam-width' is coverage equivalent to an omni; the -3 dB width is stored. The vendor does not name a plane for the 68 deg -3 dB width; it is stored for both. Also sold as LHCP. Unverified until an admin checks the source."
  },
  {
    "id": "truerc-singularity-2g4-sma",
    "name": "TrueRC Singularity 2.4 SMA",
    "vendor": "TrueRC",
    "version": 1,
    "verified": false,
    "type": "other",
    "gainDbi": 1.9,
    "polarization": "rhcp",
    "bandHz": [
      2400000000.0,
      2460000000.0
    ],
    "source": {
      "kind": "datasheet",
      "reference": "TrueRC product page, Singularity 2.4 SMA: Gain 1.9 dBic, Bandwidth 2.4GHz-2.46GHz, Polarization RHCP or LHCP",
      "url": "https://truerc.com/71973-singularity-24-sma",
      "retrieved": "2026-10-20"
    },
    "notes": "Vendor states circular-polarization gain in dBic; stored as gainDbi. Omnidirectional CP antenna. Also sold as LHCP with the same figures. Unverified until an admin checks the source."
  },
  {
    "id": "lumenier-axii-2-lr-lhcp",
    "name": "Lumenier AXII 2 Long Range 5.8GHz (LHCP)",
    "vendor": "Lumenier",
    "version": 1,
    "verified": false,
    "type": "other",
    "gainDbi": 2.2,
    "polarization": "lhcp",
    "bandHz": [
      5300000000.0,
      6200000000.0
    ],
    "source": {
      "kind": "datasheet",
      "reference": "Lumenier product page, AXII 2 Long Range 5.8GHz (LHCP): Gain 2.2dbic, Bandwidth 5.3GHz-6.2GHz, Polarization Left Hand Circular (LHCP)",
      "url": "https://www.lumenier.com/products/lumenier-axii-2-long-range-5-8ghz-antenna-lhcp",
      "retrieved": "2026-10-20"
    },
    "notes": "Vendor states circular-polarization gain in dBic; stored as gainDbi. Omnidirectional CP antenna; an RHCP version is also sold. Unverified until an admin checks the source."
  },
  {
    "id": "lumenier-axii-hd-stubby",
    "name": "Lumenier AXII HD Stubby 5.8GHz (DJI goggles)",
    "vendor": "Lumenier",
    "version": 1,
    "verified": false,
    "type": "other",
    "gainDbi": 2.2,
    "polarization": "lhcp",
    "bandHz": [
      5300000000.0,
      6200000000.0
    ],
    "source": {
      "kind": "datasheet",
      "reference": "Lumenier product page, AXII HD Stubby 5.8GHz for DJI Digital HD FPV Goggles: Gain 2.2dbic, Bandwidth 5.3GHz-6.2GHz, Beam Width 360 degrees (omni-directional), Polarization LHCP",
      "url": "https://www.lumenier.com/products/lumenier-axii-hd-stubby-5-8ghz-antenna-for-dji-digital-hd-fpv-goggles",
      "retrieved": "2026-10-20"
    },
    "notes": "Vendor states circular-polarization gain in dBic; stored as gainDbi. Replacement antenna for DJI digital FPV goggles. Unverified until an admin checks the source."
  },
  {
    "id": "lumenier-micro-axii-2-ufl",
    "name": "Lumenier Micro AXII 2 5.8GHz U.FL",
    "vendor": "Lumenier",
    "version": 1,
    "verified": false,
    "type": "other",
    "gainDbi": 1.9,
    "polarization": "rhcp",
    "bandHz": [
      5600000000.0,
      6000000000.0
    ],
    "source": {
      "kind": "datasheet",
      "reference": "Lumenier product page, Micro AXII 2 5.8GHz U.FL: Gain 1.9dBic, Bandwidth 5.6GHz-6.0GHz, Polarization RHCP or LHCP versions",
      "url": "https://www.lumenier.com/products/lumenier-micro-axii-2-antenna-5-8ghz-u-fl",
      "retrieved": "2026-10-20"
    },
    "notes": "Vendor states circular-polarization gain in dBic; stored as gainDbi. Omnidirectional CP antenna for VTX/air units. Also sold as LHCP with the same figures. Unverified until an admin checks the source."
  },
  {
    "id": "lumenier-axii-patch-hd-rhcp",
    "name": "Lumenier AXII Patch HD 5.8GHz (RHCP)",
    "vendor": "Lumenier",
    "version": 1,
    "verified": false,
    "type": "patch",
    "gainDbi": 8.4,
    "polarization": "rhcp",
    "bandHz": [
      5690000000.0,
      5910000000.0
    ],
    "beamwidthDeg": {
      "horizontal": 76,
      "vertical": 76
    },
    "source": {
      "kind": "datasheet",
      "reference": "Lumenier product page, AXII Patch HD 5.8GHz (RHCP): Gain 8.4 dBiC, Frequency 5.8GHz, Bandwidth 220 Mhz, Beam Width 76 deg",
      "url": "https://www.lumenier.com/products/lumenier-axii-patch-hd-5-8ghz-antenna-rhcp",
      "retrieved": "2026-10-20"
    },
    "notes": "Vendor states circular-polarization gain in dBic; stored as gainDbi. The vendor gives a 5.8 GHz centre and a 220 MHz bandwidth; bandHz is that centre +/- 110 MHz. The vendor does not say which plane the 76 deg beam width is in; it is stored for both. Unverified until an admin checks the source."
  },
  {
    "id": "tbs-triumph-pro-sma-rhcp",
    "name": "TBS Triumph Pro SMA (RHCP)",
    "vendor": "Team BlackSheep",
    "version": 1,
    "verified": false,